{
  "schemaVersion": "2.0.0",
  "network": "bscmainnet",
  "chainId": 56,
  "metadata": {
    "deployer": "0x6Fb9955AA9d3f77CB3281633FC6e57B249a26b21",
    "timestamp": "2025-07-25T11:11:18.006Z",
    "lastUpdated": "2025-08-12T00:00:00.000Z",
    "deploymentMode": "multi-protocol",
    "protocolsEnabled": ["layerZero", "celer"],
    "networkTier": "mainnet",
    "migrationHistory": [
      {
        "from": "v1.x",
        "to": "2.0.0",
        "timestamp": "2025-08-12T00:00:00.000Z",
        "migrator": "EnhancedSchemaDesign-Phase1.3"
      }
    ]
  },
  "contracts": {
    "core": {
      "LookCoin": {
        "proxy": "0x7d919E3ac306BBA4e5c85E40fB665126586C992d",
        "implementation": "0xF978A855042D39a81cF620B9dB6730a41Ba36270"
      },
      "SupplyOracle": {
        "proxy": "0xdD09527aBef51a5fdfb19bCceA495AE2E5eaF0B0",
        "implementation": "0x63DBfB3749E7d4a26672d3525e821d25445532C6"
      }
    },
    "protocol": {
      "LayerZeroModule": {
        "address": "0xFc79aa2AeeAc6D08d7A39faf1dbEe5AC0e63DFc8"
      },
      "CelerIMModule": {
        "proxy": "0x9177A126C719A943BdF05fbC1dC089DCa458cb9e",
        "implementation": "0x14Bed7a3e6fB31fafd700e0D867f7Dd343615541"
      }
    },
    "infrastructure": {
      "CrossChainRouter": {
        "proxy": "0xDD6e927c534fcd541a7D6053eDe35De48aD38bbc",
        "implementation": "0x0000000000000000000000000000000000000000"
      },
      "FeeManager": {
        "proxy": "0xA30ec846115c20aeF89795D0fE6dab6C05e1AaDb",
        "implementation": "0x0000000000000000000000000000000000000000"
      },
      "SecurityManager": {
        "proxy": "0x7293dE1109A1F6255A4B2c1a545c9F5Cc9708A4d",
        "implementation": "0x0000000000000000000000000000000000000000"
      },
      "ProtocolRegistry": {
        "proxy": "0x7c255412E311Cf3fd40515b0CCE3270c7f5c9CCd",
        "implementation": "0x0000000000000000000000000000000000000000"
      }
    }
  },
  "configuration": {
    "governance": {
      "vault": "0x6fb9955aa9d3f77cb3281633fc6e57b249a26b21"
    },
    "protocols": {
      "layerZero": {
        "endpoint": "0x1a44076050125825900e736c501f859c50fE728c",
        "lzChainId": 30102,
        "dvnConfig": {
          "requiredDVNs": [
            "0x589dEDbD617e0CBcB916A9223F4d1300c294236b"
          ],
          "threshold": 1
        },
        "gasLimits": {
          "97": 200000,
          "84532": 300000,
          "11155420": 350000
        }
      },
      "celer": {
        "messageBus": "0x95714818fdd7a5454f73da9c777b3ee6ebaeea6b",
        "celerChainId": 56,
        "feeConfig": {
          "baseFeeRate": 50,
          "minFee": "10000000000000000000",
          "maxFee": "1000000000000000000000"
        }
      }
    },
    "security": {
      "pauseGuardians": [
        "0x6fb9955aa9d3f77cb3281633fc6e57b249a26b21"
      ],
      "emergencyDelay": 86400
    }
  },
  "topology": {
    "connectedChains": [
      {
        "chainId": 97,
        "networkName": "bsctestnet",
        "protocols": ["layerZero", "celer"],
        "enabled": true,
        "lastHealthCheck": "2025-08-12T00:00:00.000Z"
      },
      {
        "chainId": 84532,
        "networkName": "basesepolia",
        "protocols": ["layerZero"],
        "enabled": true,
        "lastHealthCheck": "2025-08-12T00:00:00.000Z"
      },
      {
        "chainId": 11155420,
        "networkName": "optimismsepolia",
        "protocols": ["layerZero"],
        "enabled": true,
        "lastHealthCheck": "2025-08-12T00:00:00.000Z"
      }
    ],
    "routingPaths": {
      "97": {
        "preferredProtocol": "layerZero",
        "fallbackProtocols": ["celer"],
        "maxTransferAmount": "5000000000000000000000000"
      },
      "84532": {
        "preferredProtocol": "layerZero",
        "fallbackProtocols": [],
        "maxTransferAmount": "1000000000000000000000000"
      },
      "11155420": {
        "preferredProtocol": "layerZero",
        "fallbackProtocols": [],
        "maxTransferAmount": "1000000000000000000000000"
      }
    }
  },
  "verification": {
    "implementationHashes": {
      "LookCoin": "0x035df318e7b4d02767fc5d749d77c0cd1f8a24e45950df940b71de21b6b81d49",
      "SupplyOracle": "0x412d16e015a72d561a68f50bc6fd40075a8274ac4e6651c2cdba7a7ef111b33b",
      "CelerIMModule": "0xefc292208ede616ee62527e07708925ea60a9bfe42d7e1d7dd40082cc7d365fe"
    },
    "constructorArgs": {
      "LookCoin": [
        "0x6Fb9955AA9d3f77CB3281633FC6e57B249a26b21",
        {
          "type": "BigInt",
          "value": "5000000000000000000000000000"
        }
      ],
      "SupplyOracle": [
        "0x6Fb9955AA9d3f77CB3281633FC6e57B249a26b21",
        900
      ]
    }
  },
  "performance": {
    "cacheConfig": {
      "ttl": 300,
      "maxSize": 1000
    },
    "indexing": {
      "contractsByName": {
        "LookCoin": "0x7d919E3ac306BBA4e5c85E40fB665126586C992d",
        "SupplyOracle": "0xdD09527aBef51a5fdfb19bCceA495AE2E5eaF0B0",
        "LayerZeroModule": "0xFc79aa2AeeAc6D08d7A39faf1dbEe5AC0e63DFc8",
        "CelerIMModule": "0x9177A126C719A943BdF05fbC1dC089DCa458cb9e",
        "CrossChainRouter": "0xDD6e927c534fcd541a7D6053eDe35De48aD38bbc",
        "FeeManager": "0xA30ec846115c20aeF89795D0fE6dab6C05e1AaDb",
        "SecurityManager": "0x7293dE1109A1F6255A4B2c1a545c9F5Cc9708A4d",
        "ProtocolRegistry": "0x7c255412E311Cf3fd40515b0CCE3270c7f5c9CCd"
      },
      "contractsByProtocol": {
        "layerZero": [
          "0x7d919E3ac306BBA4e5c85E40fB665126586C992d",
          "0xFc79aa2AeeAc6D08d7A39faf1dbEe5AC0e63DFc8"
        ],
        "celer": [
          "0x9177A126C719A943BdF05fbC1dC089DCa458cb9e"
        ]
      }
    }
  },
  "legacy": {
    "v1Compatible": {
      "deployer": "0x6Fb9955AA9d3f77CB3281633FC6e57B249a26b21",
      "timestamp": "2025-07-25T11:11:18.006Z",
      "contracts": {
        "LookCoin": {
          "proxy": "0x7d919E3ac306BBA4e5c85E40fB665126586C992d",
          "implementation": "0xF978A855042D39a81cF620B9dB6730a41Ba36270"
        },
        "CelerIMModule": {
          "proxy": "0x9177A126C719A943BdF05fbC1dC089DCa458cb9e",
          "implementation": "0x14Bed7a3e6fB31fafd700e0D867f7Dd343615541"
        },
        "SupplyOracle": {
          "proxy": "0xdD09527aBef51a5fdfb19bCceA495AE2E5eaF0B0",
          "implementation": "0x63DBfB3749E7d4a26672d3525e821d25445532C6"
        }
      },
      "config": {
        "layerZeroEndpoint": "0x1a44076050125825900e736c501f859c50fE728c",
        "celerMessageBus": "0x95714818fdd7a5454f73da9c777b3ee6ebaeea6b",
        "governanceVault": "0x6fb9955aa9d3f77cb3281633fc6e57b249a26b21"
      },
      "implementationHashes": {
        "LookCoin": "0x035df318e7b4d02767fc5d749d77c0cd1f8a24e45950df940b71de21b6b81d49",
        "SupplyOracle": "0x412d16e015a72d561a68f50bc6fd40075a8274ac4e6651c2cdba7a7ef111b33b",
        "CelerIMModule": "0xefc292208ede616ee62527e07708925ea60a9bfe42d7e1d7dd40082cc7d365fe"
      }
    }
  }
}